{
	"$schema": "https://json-schema.org/draft/2020-12/schema",
	"$id": "https://github.com/meiluosi/strandbeest-evolution/schemas/measurement.schema.json",
	"title": "Measurement",
	"description": "Time series measured on a physical build (or synthetic data, marked as such) under stated conditions.",
	"type": "object",
	"required": [
		"schema_version",
		"id",
		"name",
		"design_id",
		"synthetic",
		"conditions",
		"channels"
	],
	"additionalProperties": false,
	"properties": {
		"schema_version": {
			"const": 2
		},
		"id": {
			"$ref": "#/$defs/Ulid"
		},
		"name": {
			"type": "string",
			"minLength": 1,
			"x-doc": {
				"zh": "测量的名字（显示用的标签）",
				"en": "Name of the measurement (a display label)"
			}
		},
		"design_id": {
			"$ref": "#/$defs/Ulid"
		},
		"design_name": {
			"type": "string",
			"x-doc": {
				"zh": "测量时设计的名字（只是显示用的快照）",
				"en": "The design's name at measurement time (a display snapshot only)"
			}
		},
		"synthetic": {
			"type": "boolean",
			"description": "true if generated by a simulator rather than measured"
		},
		"build_note": {
			"type": "string"
		},
		"conditions": {
			"type": "object",
			"required": ["kind"],
			"additionalProperties": false,
			"properties": {
				"kind": {
					"enum": ["motor_no_wind", "fan"]
				},
				"omega_rad_s": {
					"type": "number",
					"x-unit": "rad/s"
				},
				"wind_m_s": {
					"type": "number",
					"minimum": 0,
					"x-unit": "m/s"
				},
				"surface": {
					"type": "string"
				},
				"slope_deg": {
					"type": "number",
					"x-unit": "deg"
				}
			}
		},
		"channels": {
			"type": "object",
			"description": "equal-length arrays; t (s) is required. psi = crank rotation in the walking direction (rad), torque in N·m, x = body forward position (m).",
			"required": ["t"],
			"additionalProperties": {
				"type": "array",
				"items": {
					"type": "number",
					"x-unit": "1"
				}
			},
			"properties": {
				"t": {
					"type": "array",
					"items": {
						"type": "number",
						"x-unit": "s"
					},
					"minItems": 2
				}
			}
		},
		"provenance": {
			"type": "object",
			"additionalProperties": false,
			"description": "Where the numbers came from: the test rig (with its calibration) or another source.",
			"properties": {
				"source": {
					"enum": ["rig", "manual", "simulator"]
				},
				"rig_version": {
					"type": "string"
				},
				"calibration": {
					"type": "object"
				},
				"raw_file": {
					"type": "string"
				},
				"notes": {
					"type": "string"
				}
			}
		},
		"quality": {
			"type": "object",
			"additionalProperties": false,
			"description": "Automatic checks computed when the raw data were converted. Warnings are for a human to read before trusting a fit.",
			"properties": {
				"sample_rate_hz": {
					"type": "number",
					"x-unit": "Hz"
				},
				"duration_s": {
					"type": "number",
					"x-unit": "s"
				},
				"revolutions": {
					"type": "number",
					"x-unit": "1"
				},
				"speed_mean_rad_s": {
					"type": "number",
					"x-unit": "rad/s"
				},
				"speed_cv": {
					"type": "number",
					"description": "std/mean of crank speed over 0.1 s windows",
					"x-unit": "1"
				},
				"dropouts": {
					"type": "integer",
					"x-unit": "count"
				},
				"time_offset_s": {
					"type": ["number", "null"],
					"description": "offset applied when aligning video tracking to the encoder clock",
					"x-unit": "s"
				},
				"warnings": {
					"type": "array",
					"items": {
						"type": "string"
					}
				}
			}
		},
		"aliases": {
			"type": "array",
			"items": {
				"type": "string"
			},
			"x-doc": {
				"zh": "旧名字或旧 ID；指向它们的引用都解析到这个资产",
				"en": "Former names or ids; a reference to any of them resolves to this asset"
			}
		}
	},
	"$defs": {
		"Ulid": {
			"type": "string",
			"pattern": "^[0-7][0-9A-HJKMNP-TV-Z]{25}$",
			"x-doc": {
				"zh": "稳定的资产 ID（ULID，26 个字符，按创建时间可排序）",
				"en": "Stable asset id (ULID: 26 characters, sortable by creation time)"
			}
		}
	}
}
