{
	"schema_version": 2,
	"id": "01KKNVH3SR58XMRQBEFY0938NK",
	"name": "example-community-jansen-glass-2026-03-14",
	"design_id": "0000000000YNGRWX0MDFYPZHXT",
	"design_name": "jansen-small-6leg",
	"synthetic": false,
	"build_note": "EXAMPLE, NOT A MEASUREMENT: every number in this file is fabricated, to show the format of a community submission. A real submission replaces them with the numbers you measured and describes your own build here: 6-leg Jansen printed in PLA (0.2 mm layer, 20 % infill, 3 mm pins, 0.3 mm clearance), 0.002 m per length unit as in the reference design; crankshaft driven by a 6 V gear motor held at 2.0 rad/s; the walker ran on a glass sheet on a wooden table; the first 0.5 revolution was nudged by hand and is excluded from the reported stride.",
	"conditions": {
		"kind": "motor_no_wind",
		"omega_rad_s": 2.0,
		"surface": "glass sheet on a wooden table"
	},
	"channels": {
		"t": [
			0.0, 0.0333, 0.0667, 0.1, 0.1333, 0.1667, 0.2, 0.2333, 0.2667, 0.3,
			0.3333, 0.3667, 0.4, 0.4333, 0.4667, 0.5, 0.5333, 0.5667, 0.6, 0.6333,
			0.6667, 0.7, 0.7333, 0.7667, 0.8, 0.8333, 0.8667, 0.9, 0.9333, 0.9667,
			1.0, 1.0333, 1.0667, 1.1, 1.1333, 1.1667, 1.2, 1.2333, 1.2667, 1.3,
			1.3333, 1.3667, 1.4, 1.4333, 1.4667, 1.5, 1.5333, 1.5667, 1.6, 1.6333,
			1.6667, 1.7, 1.7333, 1.7667, 1.8, 1.8333, 1.8667, 1.9, 1.9333, 1.9667,
			2.0, 2.0333, 2.0667, 2.1, 2.1333, 2.1667, 2.2, 2.2333, 2.2667, 2.3,
			2.3333, 2.3667, 2.4, 2.4333, 2.4667, 2.5, 2.5333, 2.5667, 2.6, 2.6333,
			2.6667, 2.7, 2.7333, 2.7667, 2.8, 2.8333, 2.8667, 2.9, 2.9333, 2.9667,
			3.0, 3.0333, 3.0667, 3.1, 3.1333, 3.1667, 3.2, 3.2333, 3.2667, 3.3,
			3.3333, 3.3667, 3.4, 3.4333, 3.4667, 3.5, 3.5333, 3.5667, 3.6, 3.6333,
			3.6667, 3.7, 3.7333, 3.7667, 3.8, 3.8333, 3.8667, 3.9, 3.9333, 3.9667,
			4.0, 4.0333, 4.0667, 4.1, 4.1333, 4.1667, 4.2, 4.2333, 4.2667, 4.3,
			4.3333, 4.3667, 4.4, 4.4333, 4.4667, 4.5, 4.5333, 4.5667, 4.6, 4.6333,
			4.6667, 4.7, 4.7333, 4.7667, 4.8, 4.8333, 4.8667, 4.9, 4.9333, 4.9667,
			5.0, 5.0333, 5.0667, 5.1, 5.1333, 5.1667, 5.2, 5.2333, 5.2667, 5.3,
			5.3333, 5.3667, 5.4, 5.4333, 5.4667, 5.5, 5.5333, 5.5667, 5.6, 5.6333,
			5.6667, 5.7, 5.7333, 5.7667, 5.8, 5.8333, 5.8667, 5.9, 5.9333, 5.9667,
			6.0, 6.0333, 6.0667, 6.1, 6.1333, 6.1667, 6.2, 6.2333, 6.2667, 6.3,
			6.3333, 6.3667, 6.4, 6.4333, 6.4667, 6.5, 6.5333, 6.5667, 6.6, 6.6333,
			6.6667, 6.7, 6.7333, 6.7667, 6.8, 6.8333, 6.8667, 6.9, 6.9333, 6.9667,
			7.0, 7.0333, 7.0667, 7.1, 7.1333, 7.1667, 7.2, 7.2333, 7.2667, 7.3,
			7.3333, 7.3667, 7.4, 7.4333, 7.4667, 7.5, 7.5333, 7.5667, 7.6, 7.6333,
			7.6667, 7.7, 7.7333, 7.7667, 7.8, 7.8333, 7.8667, 7.9, 7.9333, 7.9667,
			8.0, 8.0333, 8.0667, 8.1, 8.1333, 8.1667, 8.2, 8.2333, 8.2667, 8.3,
			8.3333, 8.3667, 8.4, 8.4333, 8.4667, 8.5, 8.5333, 8.5667, 8.6, 8.6333,
			8.6667, 8.7, 8.7333, 8.7667, 8.8, 8.8333, 8.8667, 8.9, 8.9333, 8.9667,
			9.0, 9.0333, 9.0667, 9.1, 9.1333, 9.1667, 9.2, 9.2333, 9.2667, 9.3,
			9.3333, 9.3667, 9.4, 9.4333, 9.4667, 9.5
		],
		"psi": [
			0.0, 0.0667, 0.1333, 0.2, 0.2667, 0.3333, 0.4, 0.4667, 0.5333, 0.6,
			0.6667, 0.7333, 0.8, 0.8667, 0.9333, 1.0, 1.0667, 1.1333, 1.2, 1.2667,
			1.3333, 1.4, 1.4667, 1.5333, 1.6, 1.6667, 1.7333, 1.8, 1.8667, 1.9333,
			2.0, 2.0667, 2.1333, 2.2, 2.2667, 2.3333, 2.4, 2.4667, 2.5333, 2.6,
			2.6667, 2.7333, 2.8, 2.8667, 2.9333, 3.0, 3.0667, 3.1333, 3.2, 3.2667,
			3.3333, 3.4, 3.4667, 3.5333, 3.6, 3.6667, 3.7333, 3.8, 3.8667, 3.9333,
			4.0, 4.0667, 4.1333, 4.2, 4.2667, 4.3333, 4.4, 4.4667, 4.5333, 4.6,
			4.6667, 4.7333, 4.8, 4.8667, 4.9333, 5.0, 5.0667, 5.1333, 5.2, 5.2667,
			5.3333, 5.4, 5.4667, 5.5333, 5.6, 5.6667, 5.7333, 5.8, 5.8667, 5.9333,
			6.0, 6.0667, 6.1333, 6.2, 6.2667, 6.3333, 6.4, 6.4667, 6.5333, 6.6,
			6.6667, 6.7333, 6.8, 6.8667, 6.9333, 7.0, 7.0667, 7.1333, 7.2, 7.2667,
			7.3333, 7.4, 7.4667, 7.5333, 7.6, 7.6667, 7.7333, 7.8, 7.8667, 7.9333,
			8.0, 8.0667, 8.1333, 8.2, 8.2667, 8.3333, 8.4, 8.4667, 8.5333, 8.6,
			8.6667, 8.7333, 8.8, 8.8667, 8.9333, 9.0, 9.0667, 9.1333, 9.2, 9.2667,
			9.3333, 9.4, 9.4667, 9.5333, 9.6, 9.6667, 9.7333, 9.8, 9.8667, 9.9333,
			10.0, 10.0667, 10.1333, 10.2, 10.2667, 10.3333, 10.4, 10.4667, 10.5333,
			10.6, 10.6667, 10.7333, 10.8, 10.8667, 10.9333, 11.0, 11.0667, 11.1333,
			11.2, 11.2667, 11.3333, 11.4, 11.4667, 11.5333, 11.6, 11.6667, 11.7333,
			11.8, 11.8667, 11.9333, 12.0, 12.0667, 12.1333, 12.2, 12.2667, 12.3333,
			12.4, 12.4667, 12.5333, 12.6, 12.6667, 12.7333, 12.8, 12.8667, 12.9333,
			13.0, 13.0667, 13.1333, 13.2, 13.2667, 13.3333, 13.4, 13.4667, 13.5333,
			13.6, 13.6667, 13.7333, 13.8, 13.8667, 13.9333, 14.0, 14.0667, 14.1333,
			14.2, 14.2667, 14.3333, 14.4, 14.4667, 14.5333, 14.6, 14.6667, 14.7333,
			14.8, 14.8667, 14.9333, 15.0, 15.0667, 15.1333, 15.2, 15.2667, 15.3333,
			15.4, 15.4667, 15.5333, 15.6, 15.6667, 15.7333, 15.8, 15.8667, 15.9333,
			16.0, 16.0667, 16.1333, 16.2, 16.2667, 16.3333, 16.4, 16.4667, 16.5333,
			16.6, 16.6667, 16.7333, 16.8, 16.8667, 16.9333, 17.0, 17.0667, 17.1333,
			17.2, 17.2667, 17.3333, 17.4, 17.4667, 17.5333, 17.6, 17.6667, 17.7333,
			17.8, 17.8667, 17.9333, 18.0, 18.0667, 18.1333, 18.2, 18.2667, 18.3333,
			18.4, 18.4667, 18.5333, 18.6, 18.6667, 18.7333, 18.8, 18.8667, 18.9333,
			19.0
		],
		"torque": [
			0.0033346, 0.0035107, 0.003531, 0.0036234, 0.0035988, 0.0036602,
			0.0036548, 0.0036957, 0.0036719, 0.0036184, 0.0035305, 0.0034673,
			0.0033984, 0.003325, 0.003196, 0.0030723, 0.0029997, 0.0028923, 0.0026944,
			0.0025553, 0.0025567, 0.0022669, 0.0021739, 0.0021044, 0.0019592,
			0.0019157, 0.0017282, 0.0017857, 0.0016454, 0.0015939, 0.0014715,
			0.0014952, 0.0014171, 0.0014423, 0.0013745, 0.0013307, 0.001385,
			0.0013111, 0.0013323, 0.0013461, 0.0013372, 0.0012555, 0.0012445,
			0.0011783, 0.0012288, 0.0011527, 0.0011473, 0.0011199, 0.0010216,
			0.0010646, 0.0010538, 0.0010721, 0.0010656, 0.0010289, 0.0009528,
			0.0010016, 0.000909, 0.0009823, 0.0010022, 0.0010429, 0.0010477,
			0.0011061, 0.0011422, 0.0010949, 0.0011816, 0.0013124, 0.001348,
			0.0013554, 0.0014908, 0.0013643, 0.0014292, 0.0015574, 0.0015375,
			0.0016232, 0.0016138, 0.0015682, 0.0017719, 0.0017571, 0.0018336,
			0.001937, 0.0020395, 0.0020869, 0.0021581, 0.0021672, 0.00227, 0.0023852,
			0.0024776, 0.0026165, 0.0027479, 0.0028621, 0.0030001, 0.0030146,
			0.0031369, 0.0032823, 0.003345, 0.0034039, 0.0034717, 0.0035546,
			0.0036528, 0.003655, 0.0037366, 0.0036823, 0.0037095, 0.0036358,
			0.0035638, 0.0035812, 0.0033531, 0.0033343, 0.0031996, 0.0030725,
			0.0029779, 0.0028808, 0.0027379, 0.0025569, 0.0024342, 0.0022747,
			0.002217, 0.0021094, 0.0020363, 0.0018975, 0.0017683, 0.0017089, 0.001681,
			0.0016325, 0.0015867, 0.0014078, 0.0014026, 0.0014136, 0.0013924,
			0.0013622, 0.0014029, 0.0013149, 0.0013089, 0.0012773, 0.0012946,
			0.0013019, 0.0011675, 0.0011378, 0.001194, 0.0012078, 0.0011276, 0.0011,
			0.0011837, 0.0010565, 0.0010473, 0.0009778, 0.001001, 0.000989, 0.0009439,
			0.0009787, 0.0010357, 0.0010198, 0.0010279, 0.0010708, 0.0009907,
			0.0010777, 0.0010779, 0.0011225, 0.0011611, 0.0011276, 0.0012613,
			0.0012278, 0.0013856, 0.0014163, 0.0014423, 0.0014636, 0.001521,
			0.0015751, 0.0015862, 0.0017275, 0.0017454, 0.0018004, 0.0018595,
			0.0018527, 0.0019674, 0.0019728, 0.0021153, 0.002173, 0.0023244,
			0.0023586, 0.0025204, 0.002508, 0.002614, 0.0027857, 0.0028307, 0.0030287,
			0.0030887, 0.0032363, 0.0033892, 0.0033851, 0.0035182, 0.0035528,
			0.0036349, 0.0036154, 0.0036053, 0.003675, 0.0036534, 0.003604, 0.003538,
			0.0035947, 0.0034037, 0.0033806, 0.0033172, 0.0031754, 0.0030573,
			0.0029479, 0.0029046, 0.0026321, 0.0024962, 0.0024005, 0.0022559,
			0.0020945, 0.0020554, 0.001945, 0.0018667, 0.0016859, 0.0016418,
			0.0016221, 0.0015449, 0.0014766, 0.0015057, 0.0014862, 0.0013913,
			0.0013503, 0.0013808, 0.0012523, 0.0012922, 0.0013804, 0.0012359,
			0.0012686, 0.0012386, 0.0012712, 0.0011696, 0.0011891, 0.0012355,
			0.0011187, 0.0011556, 0.0010469, 0.0010042, 0.0010567, 0.0009876,
			0.0010087, 0.0009576, 0.0010696, 0.0010559, 0.0009835, 0.0010975,
			0.0010417, 0.000937, 0.0011565, 0.0011424, 0.0011595, 0.0011602,
			0.0012298, 0.0012858, 0.0013036, 0.0012988, 0.0014967, 0.0014819,
			0.0014633, 0.0015627, 0.0015247, 0.0016133, 0.0016152, 0.001749,
			0.0017747, 0.0017813, 0.0018575, 0.0020068, 0.0019583, 0.0021238,
			0.0021945, 0.0022831, 0.0023605, 0.0024777, 0.002545, 0.0026619,
			0.0027377, 0.0028898, 0.002949, 0.0030645, 0.0031824, 0.0032905,
			0.0034089, 0.0035221, 0.0035912
		],
		"x": [
			0.0, 0.001423, 0.002807, 0.004121, 0.005349, 0.006493, 0.007573, 0.008621,
			0.009676, 0.010776, 0.011945, 0.013197, 0.014522, 0.015897, 0.017286,
			0.018649, 0.019953, 0.021174, 0.022307, 0.023363, 0.024372, 0.025371,
			0.0264, 0.027492, 0.028666, 0.029924, 0.03125, 0.032613, 0.033975,
			0.035299, 0.036555, 0.037729, 0.038826, 0.039867, 0.040886, 0.041923,
			0.043014, 0.044185, 0.045446, 0.046788, 0.048185, 0.049601, 0.050997,
			0.052337, 0.053598, 0.054777, 0.055885, 0.05695, 0.058011, 0.059106,
			0.060265, 0.061506, 0.062828, 0.064212, 0.065627, 0.067032, 0.068391,
			0.069673, 0.070867, 0.071976, 0.073023, 0.074043, 0.075075, 0.076155,
			0.077309, 0.078546, 0.079855, 0.081211, 0.082577, 0.083916, 0.085193,
			0.086388, 0.087499, 0.088541, 0.089544, 0.090547, 0.091588, 0.0927,
			0.093899, 0.095183, 0.096535, 0.097922, 0.099304, 0.100644, 0.101915,
			0.103104, 0.104219, 0.105282, 0.106328, 0.107397, 0.108523, 0.109729,
			0.111023, 0.112392, 0.113808, 0.115235, 0.116632, 0.117966, 0.119216,
			0.12038, 0.121473, 0.122525, 0.123575, 0.12466, 0.125811, 0.127042,
			0.12835, 0.129716, 0.131105, 0.132479, 0.1338, 0.135043, 0.136196,
			0.13727, 0.138287, 0.139285, 0.140303, 0.141376, 0.142529, 0.143768,
			0.145079, 0.146436, 0.147803, 0.149139, 0.150413, 0.151608, 0.152723,
			0.153775, 0.154796, 0.155825, 0.1569, 0.158049, 0.159288, 0.160612,
			0.161998, 0.163414, 0.164818, 0.166174, 0.167456, 0.168655, 0.169778,